{
  "origins": [
    {
      "id": "1",
      "label": "Polska",
      "locations": [
        {
          "id": "2",
          "label": "Warszawa"
        },
        {
          "id": "6",
          "label": "Gdańsk"
        }
      ]
    }
  ],
  "destinations": [
    {
      "id": "3",
      "label": "Wielka Brytania",
      "locations": [
        {
          "id": "4",
          "label": "Londyn"
        },
        {
          "id": "5",
          "label": "Birmingham"
        }
      ]
    }
  ],
  "dates": {
    "from": "01-04-2024",
    "to": "31-04-2024"
  },
  "participants": [
    {
      "id": "1",
      "label": "Dorośli",
      "min": 1,
      "max": 4
    },
    {
      "id": "2",
      "label": "Dzieci 0-3 lat",
      "min": 0,
      "max": 4
    },
    {
      "id": "3",
      "label": "Dzieci 4-10 lat",
      "min": 0,
      "max": 4
    },
    {
      "id": "4",
      "label": "Dzieci 11-18 lat",
      "min": 0,
      "max": 4
    }
  ]
}
